Product Name,Average Rating,Trust Score (%),Total Reviews
Unknown Product,4.3,86.0,11
Lexus Land Cruiser Prado - Alloy Children's Sports Model Car Die-Cast Metal Toy Car - Front Doors & Boot & Hood Open - Size Approx. 5 inch - Blue,4.3,86.0,11
Unknown Product,0.0,0.0,6
Remote Controlled Fast Modern Car 3D Light for Kids (Multi Colors),0.0,0.0,1
【HOT】 1/2Pcs Baby Cartoon Safety Puppy Table Corner Protector Safe Soft Silicone Protection Edge Cover For Furniture For Kids Security,0.0,0.0,0
AirPods Pro 6 Hi-Fi Wireless Airbuds 5.0 Bluetooth Earphone Slim small size with Charging Case White,4.6,92.0,6
Lexus Land Cruiser Prado - Alloy Children's Sports Model Car Die-Cast Metal Toy Car - Front Doors & Boot & Hood Open - Size Approx. 5 inch - Blue,4.3,86.0,11
Lexus Land Cruiser Prado - Alloy Children's Sports Model Car Die-Cast Metal Toy Car - Front Doors & Boot & Hood Open - Size Approx. 5 inch - Blue,4.3,86.0,11
Keyboard Fairy Piano With Mic For Kids,4.6,92.0,6
Super Monster Truck Toy For Kids (Friction Powered Toy Car),4.7,94.0,6
"Doremon Telephone for Kids Learning Talk on Phone / Doraemon Telephone Set for Kids / Telephone Toys for Kids, Girls and Boys / Musical Doraemon Toys",4.8,96.0,6
"Urban Style New Arrival Ladies Handbags With Long Shoulders & Stylish Designs Ladies Hand Bags for Girls, Casual Women PU Leather_ Bag Stylish Hand Bag For Girls, Fashionable Large Capacity Crossbody & Shoulder Bags",5.0,100.0,9
"Comfortable Ladies Handbags With Long Shoulders & Stylish Designs Ladies Hand Bags for Girls, Casual Women PU Leather_ Bag Stylish Hand Bag For Girls, Fashionable Large Capacity Crossbody & Shoulder Bags, Women Purse Handbag & Ladies Bags For Gifts",3.9,78.0,6
"Hyper Hawk: Leather Autumn and Winter Household Slippers Home Indoor Thick Bottom Non-slip Waterproof Warm Home Slippers, suitable for most adults, Leather Slipper For Men",0.0,0.0,1
"Hyper Hawk: Leather Autumn and Winter Household Slippers Home Indoor Thick Bottom Non-slip Waterproof Warm Home Slippers, suitable for most adults, Leather Slipper For Men",4.7,94.0,6
Lexus Land Cruiser Prado - Alloy Children's Sports Model Car Die-Cast Metal Toy Car - Front Doors & Boot & Hood Open - Size Approx. 5 inch - Blue,4.3,86.0,11
"Comfortable Ladies Handbags With Long Shoulders & Stylish Designs Ladies Hand Bags for Girls, Casual Women PU Leather_ Bag Stylish Hand Bag For Girls, Fashionable Large Capacity Crossbody & Shoulder Bags, Women Purse Handbag & Ladies Bags For Gifts",3.9,78.0,6
"Black Soft Cotton Slippers for Men and Women – Durable, Stylish Indoor Slippers for All-Day Comfort",0.0,0.0,1
"Black Soft Cotton Slippers for Men and Women – Durable, Stylish Indoor Slippers for All-Day Comfort",4.3,86.0,6
"Premium Laptop bag, Travel bag",4.7,94.0,6
"Premium Laptop bag, Travel bag",4.7,94.0,6
"Premium Black Hoodie for Men & Women | Soft Fleece Sweatshirt | Winter Warm Plain Pullover | Stylish Unisex Casual Wear, men hoodie, women hoodie, fleece sweatshirt, winter hoodie, unisex hoodie, pullover hoodie, casual wear, warm hoodie,",0.0,0.0,1
Unknown Product,0.0,0.0,11
"1 pair Silicone Elastic Moisturizing Foot Socks, Spa Massage Moisturizing Gel Socks for Dry Cracked Feet",4.8,96.0,6
"Cute Bunny LED Night Light – Rechargeable Soft Silicone Bedside Lamp for Kids & Adults, Eye Protection Warm Desk Lamp, Portable Nursery Night Lamp for Bedroom, Study, and Home Décor",0.0,0.0,1
"Cute Bunny LED Night Light – Rechargeable Soft Silicone Bedside Lamp for Kids & Adults, Eye Protection Warm Desk Lamp, Portable Nursery Night Lamp for Bedroom, Study, and Home Décor",0.0,0.0,1
"Women’s Metallic Buckle Decor Flat Sandals – Adjustable Ankle Strap, Metallic Gold, Black, White, Available in Multiple Sizes",4.5,90.0,6
Unknown Product,4.7,94.0,11
1 pcs Trendy Korean Heart Lip Gloss Cute Lip Gloss Cosmetic Matte Lip Plumper | Lip Gloss Non-Stick Cup Matte Liquid Lipstick,0.0,0.0,1
1 pcs Trendy Korean Heart Lip Gloss Cute Lip Gloss Cosmetic Matte Lip Plumper | Lip Gloss Non-Stick Cup Matte Liquid Lipstick,4.7,94.0,6
Family Mixture 900gm,4.8,96.0,9
Sufi Canola Cooking Oil 1Ltr x 5 Poly Bag,4.9,98.0,11
